<?xml version="1.0" ?>
<!DOCTYPE coverage
  SYSTEM 'http://cobertura.sourceforge.net/xml/coverage-03.dtd'>
<coverage branch-rate="0.0" line-rate="0.666666666667" timestamp="1253972570431" version="3.1b1">
	<!-- Generated by coverage.py: http://nedbatchelder.com/code/coverage -->
	<packages>
		<package branch-rate="0.0" complexity="0.0" line-rate="0.666666666667" name=".">
			<classes>
				<class branch-rate="0.0" complexity="0.0" filename="a.py" line-rate="0.666666666667" name="a">
					<methods/>
					<lines>
						<line hits="1" number="3"/>
						<line hits="1" number="5"/>
						<line hits="0" number="7"/>
					</lines>
				</class>
			</classes>
		</package>
	</packages>
</coverage>
